{
  "version": 1,
  "source": {
    "repoName": "csv-stats",
    "contextPath": "CLAUDE.md",
    "contextHash": "sha256:3cad0351b53784a76f0b9690f5375c5a0dc5b368a85a48746a74996a43aeea7e",
    "generatedAt": "2026-05-11T00:04:07Z"
  },
  "summary": {
    "totalInstructions": 9,
    "totalRuns": 8,
    "verdictCounts": {
      "keep": 4,
      "update": 2,
      "remove": 2,
      "add_test": 1
    },
    "statusCounts": {
      "supported": 7,
      "unobserved": 2
    },
    "flagCounts": {
      "conflicting": 1,
      "stale": 2
    },
    "estimatedTokenChange": -87
  },
  "items": [
    {
      "id": "instr-d177f6a3",
      "verdict": "keep",
      "status": "supported",
      "flags": [],
      "title": "Project layout overview",
      "snippet": "This is the csv-stats package, a small Python utility that summarizes CSV files into JSON reports. The library lives under `src/csvstats/`, tests under `tests/`, and the CLI entry point is `csvstats`.",
      "sourceFile": "CLAUDE.md",
      "startOffset": 13,
      "endOffset": 213,
      "tokenCount": 31,
      "tokenDelta": 0,
      "metrics": {
        "sessionsObserved": 8,
        "totalSessions": 8,
        "traceEvents": 2
      },
      "reason": "Repo layout matches the description: src/csvstats/, tests/, and pyproject.toml entry point. Agents consistently navigate to these paths.",
      "evidence": [
        {
          "id": "ev-000001",
          "kind": "trace",
          "context_variant": "full",
          "label": "layout used",
          "source": ".profiler/runs/tasks/add-delimiter-flag/run-001/output/sdk-events.jsonl",
          "excerpt": "Read: .../src/csvstats/loader.py ... Read: .../tests/test_loader.py",
          "explanation": "Agents read code at the documented paths every run."
        },
        {
          "id": "ev-000002",
          "kind": "trace",
          "context_variant": "full",
          "label": "repo listing",
          "source": ".profiler/runs/tasks/add-delimiter-flag/run-001/output/sdk-events.jsonl",
          "excerpt": "src/csvstats/__init__.py, tests/test_loader.py, pyproject.toml",
          "explanation": "Repository file listing confirms the stated layout."
        }
      ]
    },
    {
      "id": "instr-40424d2c",
      "verdict": "keep",
      "status": "supported",
      "flags": [],
      "title": "Type hints and formatting",
      "snippet": "Use type hints on every public function signature and prefer `pathlib.Path` over `os.path` for filesystem work. Run `ruff check` before committing; nothing should merge that hasn't been formatted.",
      "sourceFile": "CLAUDE.md",
      "startOffset": 215,
      "endOffset": 411,
      "tokenCount": 28,
      "tokenDelta": 0,
      "metrics": {
        "sessionsObserved": 8,
        "totalSessions": 8,
        "traceEvents": 2
      },
      "reason": "Every run uses type hints (e.g., `path: Path`, `-> list[dict[str, str]]`), uses pathlib.Path, and runs `ruff check` before completion.",
      "evidence": [
        {
          "id": "ev-000003",
          "kind": "trace",
          "context_variant": "full",
          "label": "type hints + Path",
          "source": ".profiler/runs/tasks/add-delimiter-flag/run-001/output/sdk-events.jsonl",
          "excerpt": "def load_rows(path: Path, delimiter: str = \",\") -> list[dict[str, str]]:",
          "explanation": "Public function uses type hints and Path."
        },
        {
          "id": "ev-000004",
          "kind": "trace",
          "context_variant": "full",
          "label": "ruff invoked",
          "source": ".profiler/runs/tasks/add-delimiter-flag/run-001/output/sdk-events.jsonl",
          "excerpt": "Bash: ruff check src/ tests/",
          "explanation": "Agent runs ruff check as instructed."
        }
      ]
    },
    {
      "id": "instr-dd63c11a",
      "verdict": "keep",
      "status": "supported",
      "flags": [],
      "title": "Keep patches narrow and focused",
      "snippet": "Before changing code, read the files directly relevant to the request and keep the patch as narrow as possible. Prefer the obvious fix over a generalized abstraction, and do not introduce new dependencies unless the reason is clear from the diff. If the change touches shared behavior in `src/csvstats/`, add or update a focused test.",
      "sourceFile": "CLAUDE.md",
      "startOffset": 413,
      "endOffset": 747,
      "tokenCount": 55,
      "tokenDelta": 0,
      "metrics": {
        "sessionsObserved": 8,
        "totalSessions": 8,
        "traceEvents": 2
      },
      "reason": "Agents consistently read relevant files first and make narrow edits. The ablation run still behaved similarly but added a version bump that the full-context run did not, suggesting the instruction provides some restraint on scope creep.",
      "evidence": [
        {
          "id": "ev-000005",
          "kind": "trace",
          "context_variant": "full",
          "label": "narrow patch",
          "source": ".profiler/runs/tasks/add-delimiter-flag/run-001/output/sdk-events.jsonl",
          "excerpt": "Three narrow edits needed: 1. loader.py \u2014 add `delimiter` param ... 2. cli.py \u2014 add `--delimiter` flag ... 3. tests",
          "explanation": "Agent explicitly plans a narrow patch."
        },
        {
          "id": "ev-000006",
          "kind": "ablation",
          "context_variant": "ablate:instr-dd63c11a",
          "label": "scope creep without instruction",
          "source": ".profiler/runs/tasks/add-delimiter-flag/run-002/output/sdk-events.jsonl",
          "excerpt": "Bump the version (public behaviour changed): Edit: pyproject.toml -> version = \"0.2.0\"",
          "explanation": "In the ablation run-002 with this instruction removed, the agent added a version bump outside the requested scope, indicating the instruction does constrain scope."
        }
      ]
    },
    {
      "id": "instr-e7179979",
      "verdict": "update",
      "status": "supported",
      "flags": [],
      "title": "Testing conventions",
      "snippet": "Tests live under `tests/` and use pytest. Run `pytest -q` from the repo root, and add at least one test for any new public function in `src/csvstats/` -- fixtures under `tests/fixtures/` cover the common shapes, so reach for those before inventing new inputs, and lean on property-based tests around the numeric summarizers since rounding edges are easy to miss.",
      "sourceFile": "CLAUDE.md",
      "startOffset": 749,
      "endOffset": 1111,
      "tokenCount": 59,
      "tokenDelta": -17,
      "metrics": {
        "sessionsObserved": 8,
        "totalSessions": 8,
        "traceEvents": 2
      },
      "reason": "Agents use pytest, run `pytest -q`, add tests, and reuse fixtures. However, the instruction recommends property-based tests around numeric summarizers, and no run uses hypothesis or property-based tests (e.g., add-median-stat used only example-based tests). The ablation run-004 behaved identically since the work was already done.",
      "evidence": [
        {
          "id": "ev-000007",
          "kind": "trace",
          "context_variant": "full",
          "label": "pytest used",
          "source": ".profiler/runs/tasks/add-delimiter-flag/run-001/output/sdk-events.jsonl",
          "excerpt": "Bash: pytest -q 2>&1",
          "explanation": "Agents run pytest -q as instructed."
        },
        {
          "id": "ev-000008",
          "kind": "absence",
          "context_variant": "full",
          "label": "no property tests",
          "source": ".profiler/runs/tasks/add-delimiter-flag/run-001/output/sdk-events.jsonl",
          "excerpt": "def test_median_numeric_columns() -> None: # age values [36, 54, 42] ...",
          "explanation": "Median test is example-based; no hypothesis import or property-based testing was used despite the instruction calling for it."
        },
        {
          "id": "ev-000009",
          "kind": "trace",
          "context_variant": "full",
          "label": "fixtures reused",
          "source": ".profiler/runs/tasks/add-delimiter-flag/run-001/output/sdk-events.jsonl",
          "excerpt": "fixture = Path(__file__).parent / \"fixtures\" / \"sample.csv\"",
          "explanation": "Agents reach for tests/fixtures/ as suggested."
        }
      ],
      "proposedChange": {
        "kind": "update",
        "rationale": "The property-based testing clause is aspirational and not followed in practice; either drop it or add a hypothesis dependency and an example test to anchor the convention.",
        "replacement": "Tests live under `tests/` and use pytest. Run `pytest -q` from the repo root, and add at least one test for any new public function in `src/csvstats/`. Fixtures under `tests/fixtures/` cover the common shapes, so reach for those before inventing new inputs."
      }
    },
    {
      "id": "instr-cf4c5f0a",
      "verdict": "update",
      "status": "supported",
      "flags": [
        "conflicting"
      ],
      "title": "Logging and secret handling",
      "snippet": "Logging goes through the standard library `logging` module everywhere; library code must never call `print` directly, since `print` is reserved for CLI stdout output. When catching and logging an exception, use ERROR level with `exc_info=True` so the traceback is preserved. Separately, never log API keys, tokens, or user PII, and redact secrets out of any error message before it reaches a handler.",
      "sourceFile": "CLAUDE.md",
      "startOffset": 1113,
      "endOffset": 1513,
      "tokenCount": 62,
      "tokenDelta": -16,
      "metrics": {
        "sessionsObserved": 8,
        "totalSessions": 8,
        "traceEvents": 2
      },